{"$schema":"http://json-schema.org/draft-07/schema#","description":"Shot-by-shot teardowns of documented AI-film sequences for study. Prompt reconstructions are analytical reconstructions for teaching, NOT the productions' actual prompts.","properties":{"note":{"type":"string"},"observed":{"format":"date"},"teardowns":{"items":{"properties":{"context":{"type":"string"},"id":{"type":"string"},"shots":{"items":{"properties":{"breaks":{"type":"string"},"lesson":{"type":"string"},"n":{"type":"integer"},"prompt_reconstruction":{"type":["string","null"]},"setup":{"type":"string"},"title":{"type":"string"},"works":{"type":"string"}},"required":["n","title","setup","works","breaks","lesson"],"type":"object"},"type":"array"},"sources":{"items":{"format":"uri","type":"string"},"type":"array"},"subtitle":{"type":"string"},"title":{"type":"string"}},"required":["id","title","subtitle","context","sources","shots"],"type":"object"},"type":"array"},"version":{"type":"string"}},"required":["version","observed","teardowns"],"title":"ShotTeardown","type":"object"}