{
  "note": "Shot-by-shot teardowns for study. Prompt reconstructions are analytical reconstructions for teaching, NOT the productions' actual prompts. Every production fact carries its research source.",
  "observed": "2026-10-11",
  "teardowns": [
    {
      "context": "Girl realizes pre-flight that her passport is across town and races through an absurd apocalypse to get it back. Pipeline: hand-drawn storyboards \u2192 character design in Soul 2.0 \u2192 hand-painted Photoshop refinements \u2192 Blender previs \u2192 structured video prompts \u2192 Seedance 2.5 generation. The whole production was released open \u2014 every storyboard, every Blender scene, every prompt.",
      "id": "passport-rush",
      "shots": [
        {
          "breaks": "Nothing broke here; this is the stage that prevented breaks later.",
          "lesson": "Storyboard everything, even if you can't draw. Boards are the cheapest generation you'll ever make \u2014 a bad board costs minutes, a bad generation costs credits.",
          "n": 1,
          "prompt_reconstruction": null,
          "setup": "Hand-drawn storyboards locked the story before a single generation was bought. Per third-party commentary on the production: what the client approved in the boards is what ends up on screen.",
          "title": "The boards before the budget",
          "works": "Story decisions were made at the cheapest possible stage \u2014 pencil, not credits. 18 car-chase scenes were boarded before production started."
        },
        {
          "breaks": "Where previs was thin, generations drifted \u2014 unmotivated camera movement is one of the documented failure modes.",
          "lesson": "Previs is the camera department. Decide the move, the timing, and the action beat in a free tool before spending credits.",
          "n": 2,
          "prompt_reconstruction": "Reconstruction for study, not the actual prompt \u2014 \"Watercolor-stylized 3D girl sprints left-to-right across frame, camera tracks laterally at her pace, squash-and-stretch on each stride, motion-blurred background, one continuous move, no camera shake.\"",
          "setup": "Blender was used for camera movement, action timing, and squash-and-stretch \u2014 the motion was decided in previs, then AI animation executed it.",
          "title": "Blender previs as the camera department",
          "works": "One motivated camera move per shot, timed in previs. The AI model never had to invent motion grammar; it only had to execute it."
        },
        {
          "breaks": "Subtle acting collapses: micro-expressions either freeze or overshoot into caricature. The model can do broad action; it cannot do a held-back feeling without direction.",
          "lesson": "Direct tactics, not emotions. 'She decides not to cry' beats 'she looks sad' \u2014 a playable action gives the model something physical to do. See the directing-performance chapter.",
          "n": 3,
          "prompt_reconstruction": "Reconstruction for study, not the actual prompt \u2014 weak version: 'girl looks sad in taxi, cinematic.' Directed version: 'girl stares out taxi window, decides not to cry, jaw tightens once, looks down at her hands, holds still. Camera: slow push-in, stop on her eyes.'",
          "setup": "The production's own breakdown dedicates a section to 'why AI struggles with subtle character acting' and 'three challenging shots' \u2014 quiet reaction beats where the character had to feel something small.",
          "title": "The subtle-acting shots (the hard ones)",
          "works": "The team identified the failure honestly instead of cutting around it \u2014 naming the weakness is what made the breakdown valuable."
        },
        {
          "breaks": "Early tests show missing character details \u2014 the failures the breakdown honestly includes. Reference gaps = drift.",
          "lesson": "Every shot gets its reference. Character sheets, approved stills, locked start frames: consistency is a supply chain, not a prompt trick.",
          "n": 4,
          "prompt_reconstruction": null,
          "setup": "The team kept camera angles and character details consistent across 18 scenes produced in three days, using 'carefully prepared image references' to bring stylized 3D characters into a watercolor world.",
          "title": "Consistency discipline across 18 scenes in 3 days",
          "works": "Image references did the consistency work \u2014 the video model was never asked to remember what a character looked like; it was shown, every shot."
        },
        {
          "breaks": "Lighting tests that failed, characters that lost details \u2014 each one is a labeled failure mode with a visible fix.",
          "lesson": "Budget for design tests and keep your failures. A production that documents what broke is worth more than a showreel that hides it. This guide's failure-gallery chapter works the same way.",
          "n": 5,
          "setup": "The official breakdown shows failed generations, missing character details, and lighting tests \u2014 the production published its mistakes alongside its wins.",
          "title": "The failure reel",
          "works": "The failure reel is the most instructive part of the release: it shows exactly where the pipeline's guardrails are."
        }
      ],
      "sources": [
        "https://www.youtube.com/watch?v=reFzEtCG_m8",
        "https://www.youtube.com/watch?v=ZncA70OAgPw",
        "https://www.linkedin.com/posts/deykhan_we-launched-our-first-hybrid-ai-animated-activity-7510414726103851008-0KRN",
        "https://completeaitraining.com/news/higgsfield-releases-open-source-hybrid-ai-animated-short/"
      ],
      "subtitle": "Hybrid AI animation \u00b7 Higgsfield Originals (2026)",
      "title": "Passport Rush"
    },
    {
      "context": "Four friends in a dorm; three imagined worlds (a Troy battle, a galactic cruiser chase, a griffin flight over a fairytale valley). ~41,118 assets for ~20 minutes. The production brief was open-sourced (via community transcription \u2014 flagged as third-party of a first-party brief). Note: ONEIRIC has no verified Cannes premiere; the Cannes-adjacent screening was for Hell Grind, a separate work.",
      "id": "oneiric",
      "shots": [
        {
          "breaks": "Without the diagram, eyelines and positions drifted shot to shot \u2014 the classic multi-character failure.",
          "lesson": "Block dialogue like a stage play before you generate. A simple color-coded map beats a paragraph of spatial description in every prompt.",
          "n": 1,
          "prompt_reconstruction": "Reconstruction for study, not the actual prompt \u2014 'Diagram: blue = Rudy seated left on couch, green = Mara standing right by window. Shot: MCU on the blue, Rudy looks up at the green (eyeline upper-right of frame), says his line, holds. Do not move either character's seat position.'",
          "setup": "One-room dialogue continuity was 'the hardest technical task of the film \u2014 harder than the space battle.' Four characters talking in one room for minutes, without morphing.",
          "title": "The living-room dialogue (the hardest shot in the film)",
          "works": "The color-coded Diagram Skill: a schematic outline drawing attached as reference alongside real refs, each color bound to a character tag ('MCU on the blue', 'POV of the green'). Coverage became conversational."
        },
        {
          "breaks": "Lens descriptions in video prompts decayed within a scene; every shot needed re-anchoring.",
          "lesson": "Put what the model drops into the asset, not the prompt. The image stage is where look is locked; the video stage is where motion happens.",
          "n": 2,
          "prompt_reconstruction": "Reconstruction for study, not the actual prompt \u2014 image-stage: 'Living room, STRONG anamorphic look baked in: horizontal squeeze, oval elliptical bokeh in background lamps, stretched window highlights, subtle barrel edge distortion, chromatic aberration on high-contrast edges. NO lens flares. 2.39:1.' Video-stage: 'Match the reference image exactly; only animate: dust in the light beam, curtain sway.'",
          "setup": "Asking the video model for 'anamorphic' produced optics that drifted shot to shot. The fix: generate the location IMAGE with anamorphic already baked in \u2014 horizontal squeeze, oval bokeh, stretched highlights \u2014 and let the video model read the optics off the asset.",
          "title": "The consistent-lens-look trick",
          "works": "'The plate itself becomes the lens.' Lens, grade, texture, time of day \u2014 anything the video model kept dropping \u2014 moved into the image asset, not the video prompt."
        },
        {
          "breaks": "Earlier text-only chaining accumulated drift: wardrobe, lighting, and faces slowly migrated scene to scene.",
          "lesson": "Chain finished pixels, not descriptions. The last approved frame is the best prompt for the next shot.",
          "n": 3,
          "setup": "Each new scene was generated with the previous scene's FINISHED VIDEO as reference \u2014 not a text description of it.",
          "title": "The carried-reference chain",
          "works": "'A text description drifts over generations \u2014 a video reference doesn't.' The chain held look and identity across 20 minutes."
        },
        {
          "breaks": "Emotion-word prompts produced the dead-glassy-eyes failure \u2014 mathematical stillness where micro-movement should be.",
          "lesson": "Direct the eyes like blocking, not like mood. Every pair of eyes gets a job per beat. See the dead-eyes checklist.",
          "n": 4,